pauperism," the state of being a pauper, poverty", noun 
pavilion," a light, usually open building used for concerts, exhibits", noun 
payee, one to whom money is payable, noun 
peaceable," favouring peace rather than conflict, not aggressive", adjective 
peaceful, not at war or disturbed by strife or turmoil, adjective 
peccable," liable to sin, subject to transgress the divine law", adjective 
peccadillo, a very minor sin or offence, noun 
peccant, guilty of a moral offence, adjective 
pectoral," of or pertaining to the breast, the pectoral muscles", adjective 
peculate, to steal or take dishonestly, verb 
pecuniary, of or pertaining to money, adjective 
pedagogics," the science or art of teaching, pedagogy", noun 
pedagogue, a teacher, noun 
pedagogy, the function or work of a teacher, noun 
pedal, to operate a pedal attached to a wheel in a circular motion, verb 
pedant, a person who makes an excessive display of learning, noun 
pedantry," the character, qualities, practices of a pedant", noun 
peddle," to sell things, especially door to door", verb 
pedestal," an architectural support for a column, statue, vase", noun 
pedestrian," lacking in vitality, imagination, distinction, etc", adjective 
pediatrics, branch of medicine that deals with the treatment of children, noun 
pedigree, an ancestral line, noun 
peerage, the body of peers of a country or state, noun 
peerless," without equal, unparalleled, best", adjective 
peevish," showing annoyance, irritation or bad mood", adjective 
pejorative," having a disparaging, derogatory or belittling effect", adjective 
pellucid," allowing for the passage of light, transparent", adjective 
penalty, a punishment imposed for the violation of a law or rule, noun 
penance, a punishment undergone in token of penitence for sin, noun 
penchant, a strong inclination for something, noun 
pendant, a hanging ornament in jewellery, noun 
pendulum, a body suspended from a fixed support so that it swings, noun 
penetrate, to pierce through or pass into, verb 
peninsula, an area of land almost completely surrounded by water, noun 
penitence, regret for one's wrongdoing or sinning, noun 
penitent, feeling or expressing sorrow for sin or wrongdoing, adjective 
penitential, pertaining to penance or penitence, adjective 
pennant," any relatively long, tapering flag", noun 
pension," a fixed amount, other than wages, paid at regular intervals", noun 
pensive, dreamily or wistfully thoughtful, adjective 
pentad, a group or series of five things, noun 
pentagon, a polygon with five sides and five angles, noun 
pentagram," a 5-pointed star with intersecting lines, an occult symbol", noun 
pentahedron, a solid geometric figure with five faces, noun 
pentameter, a line in a poem having five metrical feet, noun 
pentathlon, an athletic contest comprising 5 track and field events, noun 
pentavalent, having a valence of 5, adjective 
penultimate, coming next-to-last in a sequence, adjective 
penurious," extremely stingy, parsimonious, miserly", adjective 
penury, extreme poverty, noun 
peon," a lowly person, a peasant who is obliged to do menial work", noun 
perambulate," to walk about, roam or stroll", verb 
perceive," to see, to be aware of, to understand", verb 
perceptive," having keenness of perception, insight or intuition", adjective 
perch," a pole or rod, serving as a roost for birds", noun 
percipient," having the ability to perceive, especially quickly", adjective 
percolate," to pass a liquid through a porous substance, to filter", verb 
percolator, a kind of coffeepot, noun 
percussion, the collision of two bodies in order to produce a sound, noun 
perdition, a state of final spiritual ruin, noun 
peregrination," a journey, especially by foot, notably by a pilgrim", noun 
peremptory, leaving no opportunity for denial or refusal, adjective 
perennial," remaining active throughout the year, or all the time", adjective 
perfectible," able to be perfected, capable of perfection", adjective 
perfidious," deliberately faithless, treacherous", adjective 
perfidy, deliberate breach of faith or trust, noun 
perforate," to pierce, to penetrate", verb 
perform," to do something, to execute", verb 
perfumery, perfumes collectively, noun 
perfunctory," performed merely as a routine duty, hasty and superficial", adjective 
perigee, point in orbit of the moon when it is nearest to the earth, noun 
peril," exposure to injury, loss or destruction", noun 
perilous, dangerous, adjective 
periodicity, the tendency to recur at regular intervals, noun 
peripatetic, tending to walk about, adjective 
peripheral, pertaining to the outside surface or boundary of an area, adjective 
periphery, the external boundary of any surface or area, noun 
perjure, to knowingly make a false statement while under oath, verb 
perjury, the willful giving of false testimony under oath, noun 
permanence, the state of being permanent, noun 
permanent," without end, eternal", adjective 
permeable, capable of being penetrated, adjective 
permeate, to penetrate and pass through without causing rupture, verb 
permissible, allowable, adjective 
permutation, a combination of items made by reordering, noun 
pernicious, causing insidious harm or ruin, adjective 
perpendicular, (geometry) meeting a given line or surface at right angles, adjective 
perpetrator, a person who commits an illegal or criminal act, noun 
perpetual," lasting forever, or for an indefinitely long time", adjective 
perpetuate, to cause to last indefinitely, verb 
perpetuity, endless or indefinitely long duration or existence, noun 
perplex," to cause to be puzzled or bewildered, confuse mentally", verb 
perquisite, any monetary or other incidental benefit beyond salary, noun 
persecution, to punish in a manner designed to injure or afflict, noun 
persevere, to persist in anything undertaken, verb 
persiflage," light, bantering talk or writing", noun 
persist, to go on steadfastly and resolutely, verb 
persnickety, fastidious or fussy, adjective 
persona, a person's perceived or evident personality, noun 
personable," having a pleasing manner, friendly, amiable", adjective 
personage, a person of distinction or importance, noun 
personal," coming from a particular person, individual, private", adjective 
personnel," employees, office staff", noun 
perspective, depicting spatial relationships on a flat surface, adjective 
perspicacious, having keen mental perception and understanding, adjective 
perspicacity, keenness of mental perception and understanding, noun 
perspicuous, clearly expressed or presented, adjective 
perspiration, sweat, noun 
perspire, to emit sweat or perspiration through the skin's pores, verb 
persuadable, capable of being convinced, adjective 
persuade, to successfully convince (someone) to do something, verb 
pert, boldly forward in speech or behaviour, verb 
pertain, to have reference or relation, verb 
pertinacious, holding tenaciously to an opinion or purpose, adjective 
pertinacity, the state or characteristic of being persistent, noun 
pertinent," important with regards to (a subject or matter), relevant", adjective 
perturb," to disturb, to bother or unsettle", verb 
perturbation," agitation, the state of being perturbed", noun 
perusal, the act of surveying, noun 
peruse, to examine or consider with care, verb 
pervade, to become spread through all parts of, verb 
pervasive," manifested throughout, penetrating or affecting everything", adjective 
perverse, willfully determined to go counter to what is expected, adjective 
perversion," humiliation, debasement", noun 
pervert, to lead astray morally, verb 
pervious, admitting of passage or entrance, adjective 
pessimism, a general belief that bad things will happen, noun 
pestilence, a deadly or virulent epidemic disease, noun 
pestilent," highly injurious or destructive to life, deadly", adjective 
peter," to dwindle, to trail off, to diminish to nothing", verb 
petrify, to convert into stone or a stony substance, verb 
petrous," like stone, especially in hardness", adjective 
petulance, the state or quality of being petulant, noun 
petulant," showing sudden, impatient irritation", adjective 
pharmacopoeia, an official book describing medicines, noun 
pharmacy, a place where prescription drugs are dispensed, noun 
phenomenal," very remarkable, highly extraordinary, amazing", adjective 
philander, to make love with a woman one cannot marry, verb 
philanthropic, benevolent, adjective 
philately, stamp collecting, noun 
philharmonic, a full-size symphonic orchestra, noun 
philippic, any speech or discourse of bitter denunciation, noun 
philistine, a person lacking in cultural values, noun 
philogynist, someone who is fond of women as a group, noun 
philologist, a person who studies literary texts and written records, noun 
philology, the study of literary texts and of written records, noun 
philosophy, the rational investigation of the principles of being, noun 
phlegmatic, not easily excited to action or display of emotion, adjective 
phobia, an irrational or obsessive fear or anxiety, noun 
phonetic, relating to the sounds of spoken language, adjective 
phonic, of or pertaining to speech sound, adjective 
phonogram," a part of a writing system, standing for a sound or syllable", noun 
phonology, the study of the patterning of speech sounds in a language, noun 
phosphorescence, the emission of light without any perceptible heat, noun 
photoelectric, pertaining to electric effects produced by light, adjective 
photometer, an instrument that measures brightness, noun 
photometry, the measurement of the intensity of light, noun 
physiocracy, belief that land is the basis of wealth and taxation, noun 
physiognomy, the face or countenance, noun 
physiography, the science of physical geography, noun 
physiology, biology dealing with the functions of living organisms, noun 
picaresque, a form of fiction depicting the adventures of a roguish hero, adjective 
picayune," petty, trivial, of little consequence", adjective 
piccolo," an instrument similar to a flute, but smaller", noun 
piece, de resistance the principal dish of a meal, noun 
piecemeal, made or done in pieces or one stage at a time, adjective 
pied, having patches of two or more colours, adjective 
piety, devout fulfillment of religious obligations, noun 
pilfer, to steal in small quantities, verb 
pillage," to loot or plunder by force, especially in time of war", verb 
pillory, a wooden frame with holes for securing the head and hands, noun 
pincers, a gripping tool with blunt jaws, noun 
pinch, to squeeze or compress between something, noun 
pinion, a bird's wing, noun 
pinioned, tie or hold the arms or legs of (someone), verb 
pinnacle, a high peak, noun 
pioneer, a person who is among those who first settle a region, noun 
pious, having a dutiful spirit of reverence for god, adjective 
piquancy, a food's level of pungency, noun 
piquant, agreeably pungent or sharp in taste or flavour, adjective 
pique, to affect with irritation and resentment, verb 
piteous, evoking or deserving pity, adjective 
pith, the soft central cylinder of tissue in a plant stem, noun 
pithy," brief, forceful and meaningful in expression", adjective 
pitiable," evoking or deserving pity, pitiful", adjective 
pitiful, evoking or deserving pity, adjective 
pitiless, feeling or showing no pity, adjective 
pittance," a small allowance of food and drink, a scanty meal", noun 
pivotal, of vital or critical importance, adjective 
placate, to appease or pacify, verb 
placebo, a dummy medicine containing no active ingredients, noun 
placid," calm and quiet, peaceful, tranquil", adjective 
plagiarism, using the language and thoughts of another author, noun 
plaintiff, a party bringing a suit in civil law against a defendan, noun 
plaintive," sorrowful, mournful or melancholic", adjective 
planisphere, a map of the celestial sphere indicating a visible location, noun 
plasticity, the capability of being molded to assume a desired form, noun 
platitude," a flat, dull or trite remark", noun 
platonic, free from sensual desire, adjective 
plaudit," a mark or expression of applause, praise bestowed", noun 
plausible," seemingly or apparently likely, or acceptable", adjective 
playwright, a writer and creator of theatrical plays, noun 
plea," an appeal, petition, urgent prayer or entreaty", noun 
pleasant," giving pleasure, pleasing in manner", adjective 
pleasurable, enjoyable, adjective 
plebeian, belonging or pertaining to the common people, adjective 
plebian, alternative spelling of plebeian, adjective 
pledgee, someone who receives a pledge, noun 
pledgeor, a person who gives or makes a pledge, noun 
plenary," fully attended, for everyone's attendance", adjective 
plenipotentiary, a person with power to do business on behalf of another, adjective 
plenitude," an abundance, plenty, a full supply", noun 
plenteous," of or pertaining to plenty, abundance", adjective 
plethora," overabundance, excess", noun 
pliable, easily bent, adjective 
pliant," capable of bending, flexible, pliable", adjective 
plod, to walk or move slowly and heavily, verb 
pluck," to pull something sharply, to pull something out", verb 
plumage," feathers, either covering a bird or used ornamentally", noun 
plummet," to drop swiftly, in a direct manner, to fall quickly", verb 
pluperfect, perfect with respect to a point of reference in past time, adjective 
plural, consisting of or containing more than one of something, adjective 
plurality, fact of being numerous, noun 
plutocracy, the rule or power of wealth or the wealthy, noun 
pneumatic, of or relating to air or other gases, adjective 
podium," a small platform for a public speaker, a conductor, etc", noun 
poesy, the class of literature comprising poems, noun 
poetaster, an unskilled poet, noun 
poetic, possessing the qualities or charm of poetry, adjective 
poignant, keenly distressing to the feelings, adjective 
poise," calm self-assured dignity, especially in social situations", verb 
polar, of or relating to the north or south pole, adjective 
polemic, a controversial argument, noun 
politic, shrewd or prudent in practical matters, adjective 
pollen, the fertilizing element of flowering plants, noun 
pollute, to make foul or unclean, verb 
poltroon," a wretched coward, craven", noun 
polyarchy, government in which power is invested in 3 or more persons, noun 
polycracy," government by many rulers, polyarchy", noun 
polygamy, the custom of having more than one spouse at the same time, noun 
polyglot, able to speak or write several languages, adjective 
polygon, a figure having three or more sides, noun 
polyhedron, a solid figure with many flat faces and straight edges, noun 
polysyllable, a word with more than two syllables, noun 
polytechnic, offering instruction in a variety of technical subjects, adjective 
polytheism, the belief of the existence of many gods, noun 
pommel," a knob, as on the hilt of a sword", noun 
pomposity," the quality of being pompous, self-importance", noun 
pompous," affectedly grand, solemn or self-important", adjective 
ponder," to wonder, to think of deeply", verb 
pontiff, any high or chief priest, noun 
pontificate," to preside as a bishop, especially at mass", verb 
populace, the common people of a nation, noun 
populous," full of residents, as a region, heavily populated", adjective 
portend, to serve as a warning or omen, verb 
portent, an indication or omen of something about to happen, noun 
portentous," ominously significant, portending evil", adjective 
portfolio, a large flat case for carrying documents, noun 
portly, rather heavy or fat, adjective 
poseur, a person who attempts to impress others by assuming a manner, noun 
posit," to place, put or set", verb 
posse, a body or force armed with legal authority, noun 
possess," to have, to have ownership of", verb 
possessor, one who possesses, noun 
postdate, to date with a date in the future, verb 
posterior," located behind, or towards the rear of an object", adjective 
posterity, succeeding or future generations collectively, noun 
postgraduate, further studies after completing a degree, adjective 
posthumous," arising, occurring or continuing after one's death", adjective 
postscript, a paragraph or phrase added to a concluded letter, noun 
postulate," to ask, demand or claim", verb 
potable, good for drinking without fear of poisoning or disease, adjective 
potency, strength, noun 
potent," powerful, mighty", adjective 
potentate," a powerful leader, a monarch, a ruler", noun 
potential," existing in possibility, not in actuality", adjective 
potion," a drink or draft, especially a magical one", noun 
potpourri, a mixture of dried petals of roses or other spices, noun 
pragmatic, pertaining to a practical point of view, adjective 
pragmatist," practical person, realist", noun 
prate," to talk much and to little purpose, to babble", verb 
prattle," to talk incessantly and in a childish manner, to babble", verb 
preamble, an introductory statement, noun 
precaution, a measure taken in advance to secure good results, noun 
precede," to go before, go in front of", verb 
precedent, (law) a legal decision serving as an authoritative rule, noun 
precept, a commandment given as a rule of action or conduct, noun 
precession, precedence, noun 
precinct, a district in a city marked out for government purposes, noun 
precipice, a very steep cliff, noun 
precipitant, falling headlong, adjective 
precipitous, extremely steep, adjective 
precise," exact, accurate", adjective 
precision, accuracy, noun 
preclude," to prevent the occurrence of, make impossible", verb 
precocious, unusually advanced or mature in development, adjective 
precursor, something that precedes, noun 
predatory," of, or relating to a predator", adjective 
predecessor, something replaced by something else, noun 
predicament," a difficult, perplexing or dangerous situation", noun 
predilection, a tendency to think favourably of something in particular, noun 
predispose, to make someone susceptible to something (such as a disease), verb 
predominance, the condition or state of having power over others, noun 
preeminence," the status of being preeminent, dominant or ascendant", noun 
preeminent, exceeding others in quality or rank, adjective 
preempt, to acquire something (before someone else does), verb 
preengage, to engage beforehand, verb 
preestablish, to establish beforehand, verb 
preexist, to exist before something else, verb 
preface," an introductory part, or preliminary statement", noun 
prefatory," introductory, preliminary, serving as a prelude or preface", adjective 
prefix, an affix placed before a word to modify a term's meaning, noun 
prehensile, able to take hold of and clasp objects, adjective 
prehension, the act of grasping or gripping something, noun 
prejudice, an unfavourable opinion formed without knowledge or reason, noun 
prelacy, the office of a prelate, noun 
prelate, a church dignitary, noun 
prelude, any action or event that precedes something else, noun 
premature, occurring too soon, adjective 
premeditated," done deliberately, planned in advance", adjective 
premier, the head of the cabinet in some countries, noun 
premise, a proposition supporting or helping to support a conclusion, noun 
premonition, a forewarning of a future event, noun 
preoccupy," to distract, to occupy or draw attention elsewhere", verb 
preordain, to determine the fate of something in advance, verb 
preparation, the act of getting ready for something, noun 
preponderance, excess or superiority of influence, noun 
prepossess, to occupy beforehand, verb 
preposterous," absurd, or contrary to common sense", adjective 
prerogative, having a hereditary or official right or privilege, adjective 
presage, foreboding, noun 
prescience, knowledge of things before they happen, noun 
prescient, having knowledge of events before they take place, adjective 
prescribe, to order (a drug) for use by a particular patient, verb 
prescript," something prescribed, a rule, regulation or dictate", noun 
prescription, paper from doctor for pharmacist stating medication you need, adjective 
presentient, having a premonition, adjective 
presentiment, a feeling that something is about to happen, noun 
presentment, a statement made on oath by a jury, noun 
preservation, to keep alive or in existence, verb 
preside, to occupy the place of authority or control, verb 
prestigious, of high honour or reputation, adjective 
presumption, assumption of something as true, noun 
preternatural," strange, inexplicable, extraordinary, abnormal", adjective 
pretext, something put forward to conceal a true purpose or object, noun 
prevail," to be superior in strength, dominance, influence", verb 
prevalence, the quality or condition of being widespread, noun 
prevaricate," to deviate, transgress, to go astray (from)", verb 
prevention, the act of keeping something from occurring, noun 
prickle, a sharp point, noun 
prig, a person who is self-righteous and narrow-minded, noun 
priggish, like a prig, adjective 
prim, precise or proper, adjective 
prima, most important, adjective 
primer, a book that provides an introduction to a topic, noun 
primeval, belonging to the first ages, adjective 
primitive," of, or pertaining to, the beginning or origin", adjective 
primordial," first, earliest or original", adjective 
principle, a fundamental assumption, noun 
priory, a monastery or convent governed by a prior or prioress, noun 
pristine," unspoiled, still with its original purity", adjective 
privateer, private ship built by the government to harass enemy ships, noun 
privation, lack of the usual comforts of life, noun 
privilege, to grant some particular right or exemption to, verb 
privity," a divine mystery, something known only to god", noun 
privy, having knowledge of something private or secret, adjective 
probate, the official proving of a will as authentic, noun 
probe," to explore, investigate, or question", verb 
probity, integrity and uprightness, noun 
procedure, a particular method for performing a task, noun 
proceed," to go forward or onward, to advance", verb 
proclamation, a public and official announcement, noun 
proclivity, natural or habitual inclination, noun 
procrastinate," to put off, to delay taking action, to wait until later", verb 
proctor, to supervise or monitor, verb 
procure, to obtain through special means, verb 
prodigy, a young person having extraordinary talent or ability, noun 
productive," capable of producing something, especially in abundance", adjective 
profane, irreligious, adjective 
profess," to make open declaration of, to own or admit freely", verb 
professor, a teacher or faculty member at a college or university, noun 
proffer," to offer for acceptance, to propose to give", verb 
proficient," good at, skilled, fluent, practiced", adjective 
profiteer, a person who seeks exorbitant profits, noun 
profligacy, careless wastefulness, noun 
profligate, utterly immoral, adjective 
profound, entering deeply into subjects of thought or knowledge, adjective 
profuse, spending or giving freely and in large amount, adjective 
profusion," abundance, the state of being profuse, a cornucopia", noun 
progenitor," a forefather, any of a person's direct ancestors", noun 
progeny, offspring or descendants, noun 
prognosis, a forecast of the future course of a disease or disorder, noun 
prognosticate, to predict or forecast, verb 
progression, the act of moving from one thing to another, noun 
prohibition," an act of prohibiting, forbidding, or disallowing something", noun 
prohibitory, that serves to prohibit or forbid, adjective 
projection, something which sticks out, noun 
proletarian, of or relating to the working class, adjective 
proletariat, the working class or lower class, noun 
proliferate, to grow or produce by multiplication of parts, verb 
prolific, producing offspring abundantly, adjective 
prolix," extended to great, unnecessary or tedious length", adjective 
prologue," an introduction, especially to a play or novel", noun 
prolong, to extend in space or length, verb 
promenade, to walk, verb 
prominence, the state of being prominent: widely known or eminent, noun 
promiscuous, having casual sexual relations with a number of partners, adjective 
promissory, containing or consisting of a promise, adjective 
promontory, a high point of land extending into a body of water, noun 
promoter, one who promotes, noun 
promulgate, to make known or public, verb 
propaganda, information or ideas spread deliberately to help or harm, noun 
propagate, to cause an organism to multiply, verb 
propel, to cause to move in a certain direction, verb 
propellant, something that causes an object to be driven forward, noun 
propeller, a mechanical device with rotating blades, noun 
propensity," a tendency, preference, or attraction", noun 
prophecy," a prediction, especially one made by a prophet", noun 
prophesy, to speak or write with divine inspiration, verb 
propinquity, nearness in place, noun 
propitiate, to make favourably inclined, verb 
propitious, presenting favourable opinions, adjective 
proponent," one who supports something, an advocate", noun 
proportionate, adjusted to proper proportion, adjective 
propound," to put forward, to offer for discussion or debate", verb 
proprietary, of relating to property or ownership, adjective 
propriety, conformity to established standards of proper behaviour, noun 
propulsion, force causing movement, noun 
