inchoative," at the beginning, still in an unformed state", adjective 
incidence, the rate or range of occurrence of something, noun 
incident," arising as the result of an event, inherent", adjective 
incidental," loosely associated, existing as a by-product, tangent", adjective 
incinerate, to destroy by burning, verb 
incipient," a beginning, or first stage", adjective 
incisal, relating to the cutting edge of the incisor and cusped teeth, adjective 
incise," to cut into, cut marks, figures, etc", verb 
incisive," penetrating, cutting, biting, trenchant", adjective 
incisor," one of the front teeth of mammals, between the canines", noun 
incite," to rouse, stir up or excite", verb 
incitement," a call to act, encouragement to act", noun 
inclement," stormy, of rough weather", adjective 
inclination," a disposition or bent, especially of the mind or will", noun 
inclusive, the stated limit or extreme in consideration, adjective 
incoercible," not to be coerced, incapable of being compelled or forced", adjective 
incoherent," not coherent, not in a consistent fashion", adjective 
incombustible," not capable of catching fire and burning, not flammable", adjective 
incomparable, so much better than another as to be beyond comparison, adjective 
incompatible," of two things, impossible to coexist, irreconcilable", adjective 
incompetent," unskilled, lacking normally expected degree of ability", adjective 
incomplete," not complete, not finished, not having all its parts", adjective 
incomprehensible, impossible or very difficult to understand, adjective 
incompressible, not compressible, adjective 
inconceivable," unable to be conceived, unbelievable", adjective 
incongruous," out of keeping or place, inappropriate, unbecoming", adjective 
inconsequential," having no consequence, of little importance", adjective 
inconsiderable, too trivial or unimportant to be worthy of attention, adjective 
inconsistent, not consistent, adjective 
inconspicuous, not prominent or easily noticeable, adjective 
inconstant," not constant, wavering", adjective 
incontrovertible," not open to question or dispute, indisputable", adjective 
inconvenient, not convenient, adjective 
incorrigible," not corrigible, bad beyond correction or reform", adjective 
incredulity," unwillingness or inability to believe, doubt, disbelief", noun 
incredulous," skeptical, disbelieving, or unable to believe", adjective 
increment," to increase by steps or by a step, especially by one", verb 
incubus, an evil spirit supposed to oppress people while asleep, noun 
inculcate," to implant by repeated statement, teach persistently", verb 
incumbent," holding an indicated position, role, office, etc", adjective 
incursion," a hostile entrance into or invasion of a place, a raid", noun 
indefatigable, extremely persistent and untiring, adjective 
indefensible," not defensible, not capable of being defended, vulnerable", adjective 
indefinite," not definite, without fixed or specified limit", adjective 
indelible," making marks that cannot be erased, removed, or the like", adjective 
indemnify," to compensate for damage or loss sustained, expense, etc", verb 
indemnity, obligation upon an individual to incur the losses of another, noun 
indescribable," impossible, or very difficult to describe", adjective 
indestructible," not destructible, incapable of being destroyed, invincible", adjective 
indicant," something that indicates, indicator", noun 
indicator, a person or thing that indicates something, noun 
indict," to accuse of wrongdoing, charge", verb 
indictment, a formal accusation initiating a criminal case, noun 
indifferent," not caring, apathetic", adjective 
indigence, extreme poverty or destitution, noun 
indigenous," born or engendered in, native to a land or region", adjective 
indigent," lacking food, clothing, etc because of poverty", adjective 
indigestible, difficult or impossible to digest, adjective 
indigestion, a common medical condition often caused by eating quickly, noun 
indignant," showing anger or indignation, esp. at something unjust", adjective 
indignity, an injury to a person's dignity, noun 
indiscernible," not discernible, that cannot be seen or perceived clearly", adjective 
indiscreet," not discreet, lacking prudence or circumspection", adjective 
indiscriminate," not discriminating, lacking in care, judgment, etc", adjective 
indispensable," absolutely necessary, essential, or requisite", adjective 
indistinct," not clearly defined or not having a sharp outline, faint", adjective 
indivertible, not to be diverted or turned aside, adjective 
indolence, habitual laziness or sloth, noun 
indomitable," that cannot be subdued or overcome, as persons or courage", adjective 
indubitable," clearly true, providing no possibility of doubt", adjective 
induce," to lead by persuasion or influence, incite", verb 
induct," to formally or ceremoniously install in an office, position", verb 
inductee, a person who is inducted into an organization, noun 
indulge," (often followed by ""in""): to yield to a temptation or desire", verb 
industrious," working energetically and devotedly, hard-working", adjective 
inebriate, to cause to be drunk, verb 
inebriation, the state or characteristic of drunkenness, noun 
inedible, unfit to be eaten, adjective 
ineffable, incapable of being expressed or described in words, adjective 
inefficacious," not able to produce the desired effect, ineffective", adjective 
inefficient, unable to achieve the desired result economically, adjective 
ineligible," not eligible, not permitted or suitable", adjective 
ineluctable," incapable of being evaded, inescapable", adjective 
inept," not able to do something, not proficient", adjective 
inert," unable to move or act, inanimate", adjective 
inertia, the property of a body that resists any change to its motion, noun 
inestimable, not able to be estimated as because of great scale or degree, adjective 
inevitable, impossible to avoid or prevent, adjective 
inexcusable, not excusable, adjective 
inexhaustible," impossible to exhaust, unlimited", adjective 
inexorable," unyielding, unalterable", adjective 
inexpedient," not tending to the end desired, inadvisable, unfit, improper", adjective 
inexpensive, low in price, adjective 
inexperience, a lack of experience, noun 
inexplicable," impossible to explain, not easily accounted for", adjective 
inexpressible, unable to be expressed, adjective 
inextensible, not capable of being extended, adjective 
inextricable, impossible to untie or disentangle, adjective 
infallible," unfailing in effectiveness or operation, certain", adjective 
infamous," having a bad reputation, of bad report, notoriously vile", adjective 
infamy," extremely bad reputation, public reproach", noun 
infer," to derive by reasoning, conclude from premises or evidence", verb 
inference, the act or process of inferring by deduction or induction, noun 
infernal," hellish, fiendish, diabolical", adjective 
infest, to live in or overrun to an unwanted degree, verb 
infidel, a non-believer of a certain religion, noun 
infiltrate," to surreptitiously penetrate, enter or gain access", verb 
infinite," indefinably large, countlessly great, immense", adjective 
infinitesimal," incalculably, exceedingly, or immeasurably minute", adjective 
infirm," to contradict, to provide proof that something is not", verb 
infirmary, a place where sick or injured people are cared for, noun 
infirmity," feebleness, frailty or ailment, especially due to old age", noun 
inflammable," capable of burning, easily set on fire", adjective 
inflammatory, tending to inflame or provoke somebody, adjective 
inflexible," not flexible, not capable of bending or being bent, stiff", adjective 
influence," the capacity to be a compelling force on actions,", behavior 
influx, a flow inward or into something, noun 
infraction," a minor offence, petty crime", noun 
infrastructure," the basic, underlying framework of a system of organization", noun 
infrequent," rarely happening or present, only occasional", adjective 
infringe," break or violate a treaty, a law, a right etc", verb 
infuse," to cause to become an element of something, insert or fill", verb 
infusion, that which is infused, noun 
ingenious," displaying genius or brilliance, tending to invent", adjective 
ingenue," an innocent, naïve, wholesome girl or young woman", noun 
ingénue, alternative spelling of ingénue, noun 
ingenuous, naive and trusting, adjective 
inglorious," ignominious, disgraceful, not famous, obscure", adjective 
ingraft," to insert, as of one plant into another, for propagation", verb 
ingrate, ungrateful, adjective 
ingratiate, to establish (oneself) in the favor or good graces of others, verb 
ingratitude," a lack or absence of gratitude, thanklessness", noun 
inherent, naturally a part or consequence of something, adjective 
inhibit," to hinder, to restrain", verb 
inhospitable," not inclined to hospitality, unfriendly", adjective 
inhuman, of or pertaining to inhumanity and the indifferently cruel, adjective 
inhume, to bury in a grave, verb 
inimical," adverse in tendency or effect, unfavorable, harmful", adjective 
inimitable," beyond imitation, surpassing all others, matchless", adjective 
iniquitous, characterized by injustice or wickedness, adjective 
iniquity," deviation from what is right, wickedness, gross injustice", noun 
initiate," to begin, to start, to introduce", verb 
inject, to pump (especially fluids) into a cavity or passage, verb 
injunction," the act of enjoining, the act of directing, commanding", noun 
inkling, a slight suspicion or hint, noun 
inland," within the land, remote from the ocean", adjective 
inlet," an indentation of a shoreline, small bay or arm", noun 
inmost," the very deepest within, innermost", adjective 
innate," existing in one from birth, inborn, native", adjective 
innocuous," not harmful or injurious, harmless", adjective 
innovate," to alter, to change into something new", verb 
innuendo, a derogatory hint or reference to a person or thing, noun 
innumerable," not capable of being counted, indefinitely numerous", adjective 
inoculate, to introduce an antigenic substance or vaccine into the body, verb 
inoffensive, not offensive, adjective 
inopportune, unsuitable for some particular purpose, adjective 
inordinate," excessive, unreasonable or inappropriate in magnitude", adjective 
inquire, to ask (about something), verb 
inquisition, an investigation or inquiry into the truth of some matter, noun 
inroad," an advance into enemy territory, an attempted invasion", noun 
insatiable, a damaging or serious encroachment, noun 
inscribe," to write or cut words onto something, to engrave", verb 
inscrutable," difficult or impossible to comprehend, fathom, or interpret", adjective 
insecure, not secure, adjective 
insensible, unable to be perceived by the senses, adjective 
insentient," having no consciousness or animation, not sentient", adjective 
inseparable," not able to be separated, bound together permanently", adjective 
insidious, intended to entrap or beguile, adjective 
insight," a sight or view of the interior of anything, introspection", noun 
insinuate, to make a way for or introduce something by subtle means, verb 
insipid," without distinctive, interesting, or stimulating qualities", adjective 
insistent, standing or resting on something, adjective 
insolence," arrogant conduct, insulting, bold behaviour or attitude", noun 
insolent, insulting in manner or words, adjective 
insomnia, a sleeping disorder that is known for inability to sleep, noun 
insouciant," free from concern, worry, or anxiety, carefree, nonchalant", adjective 
inspector, a person employed to inspect something, noun 
instance," to mention as a case or example, to refer to, to cite", verb 
instant," an infinitesimal or very short space of time, a moment", adjective 
instigate," to goad or urge forward, to set on, to provoke, to incite", verb 
instigator, a person who intentionally incites or starts something, noun 
instill, to cause a quality to become part of someone's nature, verb 
institute, to begin or initiate something, verb 
instructive," conveying knowledge, information or instruction", adjective 
insufficient, not sufficient, adjective 
insular," of, pertaining to, being, or resembling an island or islands", adjective 
insulate," cover or line with material to prevent passage of heat, etc", verb 
insult," to treat or speak to insolently, with contemptuous rudeness", verb 
insuperable, impossible to achieve or overcome or be negotiated, adjective 
insuppressible, that cannot be suppressed, adjective 
insurgence," an uprising or rebellion, an insurrection", noun 
insurrection," an organized opposition to an authority, a rebellion", noun 
intangible," incapable of being perceived by the senses, incorporeal", adjective 
integral," constituting a whole together, not omittable or removable", adjective 
integrity, adherence to moral and ethical principles, noun 
intellect," the faculty of thinking, judging, abstract reasoning, etc", noun 
intelligible," capable of being understood, comprehensible, clear", adjective 
intemperance," lack of moderation or temperance, excess", noun 
intension," intensification, increase in degree", noun 
intention, a course of action that a person intends to follow, noun 
inter, to bury in a grave, verb 
interact, to act one upon another, verb 
intercede, to plea on someone else's behalf, verb 
intercept," to stop, deflect or divert (something in progress or motion)", verb 
intercession, an act or instance of interceding, noun 
intercessor," a person who intercedes, a mediator", noun 
interdict, any prohibitory decree of a court or administrative officer, noun 
interim," an intervening time, transitional, meantime", adjective 
interject, to insert something between other things, verb 
interlocutor, a person who takes part in dialogue or conversation, noun 
interloper, a person who interferes or meddles in the affairs of others, noun 
interlude," an intervening episode, space, period, etc", verb 
intermediate," to mediate, to be an intermediate", verb 
interminable," existing or occurring without interruption or end, ceaseless", adjective 
intermission," a break between two performances or sessions (concert, etc)", noun 
intermit," to interrupt, to stop or cease temporarily, to suspend", verb 
internecine, of or pertaining to conflict or struggle within a group, adjective 
interpolate, to introduce (something additional) between other things, verb 
interpose, to insert something (or oneself) between other things, verb 
interpreter, one who translates the words of a speaker to the audience, noun 
interrogate," to question or quiz, especially in a thorough manner", verb 
intersect," to cross, to cut", verb 
intersperse, to mix irregularly something with something else, verb 
interstice, a small opening or space between objects, noun 
intervale, a lowly tract of land along a river, noun 
intervene," to come between, or to be between, persons or things", verb 
intestacy, the state of dying without having made a valid will, noun 
intestate, to be without a valid will, adjective 
intestine, the lower part of the alimentary canal, noun 
intimacy, the state of being intimate, noun 
intimation," the act of intimating, also, the thing intimated", noun 
intimidate," to make timid or fearful, to inspire or affect with fear", verb 
intolerable," not capable of being borne or endured, insufferable", adjective 
intoxicant," an intoxicating agent, as alcohol or drugs", adjective 
intoxicate, to stupefy by doping with chemical substances like alcohol, verb 
intracellular, inside or within a cell, adjective 
intractable," not easily controlled, not docile or manageable, stubborn", adjective 
intramural, pertaining to something within one institution, adjective 
intransigent," unwilling to compromise or moderate a position, stubborn", adjective 
intrepid," resolutely fearless, dauntless", adjective 
intricacy, the state or quality of being intricate or entangled, noun 
intricate, to become enmeshed or entangled, verb 
intrigue, to conceive or carry out a secret plan intended to harm, verb 
intrinsic," innate, inherent, inseparable from itself, essential", adjective 
introductory," introducing, giving a preview or idea of", adjective 
introgression, genes of one species introduced in the gene pool of another, noun 
intromit," to send, put or let in, to introduce, to admit", verb 
introspect, consider one's own internal state or feelings, verb 
introvert," one who focuses on their own mind, feelings, or affairs", noun 
intrude, to enter without permission, verb 
intuition, immediate cognition without the use of rational processes, noun 
intuitive," doesn't require conscious thought, understood by intuition", adjective 
inundate," to cover with large amounts of water, to flood", verb 
inundation," an overflow, a flood", noun 
inure," to come into use, take or have effect", verb 
inured," to accustom to hardship, difficulty, pain, etc", verb 
invalid, an infirm or sickly person, noun 
invalidate," to make invalid, especially applied to contract law", verb 
invaluable," of great value, costly, precious, priceless", adjective 
invariable," not variable, constant", adjective 
invasion, a military action of armed forces entering another territory, noun 
invective," vehement or violent denunciation, censure, or reproach", noun 
inveigh, to protest strongly or attack vehemently with words, verb 
inveigle," to convert, convince or win over with flattery or wiles", verb 
inventive," of, or relating to invention", adjective 
inverse," reversed position, direction, or tendency", adjective 
inversion, the action of inverting, noun 
invert, to turn (something) upside down or inside out, verb 
investigator, one who investigates, noun 
investor, a person who invests money in order to make a profit, noun 
inveterate," settled or confirmed in a habit, practice, or feeling", adjective 
invidious, calculated to create ill will or resentment or give offense, adjective 
invigorate," to impart vigor, strength, or vitality to", verb 
invincible," impossible to defeat, destroy or kill", adjective 
inviolable, not susceptible of violence or of being profaned/corrupted, adjective 
invocation, the act of calling for the presence of some superior being, noun 
invoke," to call upon (a person, especially a god) for help", verb 
involuntary," without intention, unintentional", adjective 
involution," entanglement, a spiralling inwards, intricacy", noun 
involve," to roll or fold up, to wind round, to entwine", verb 
invulnerable," incapable of being wounded, or of receiving injury", adjective 
inwardly," in or on, or with reference to, the inside or inner part", adjective 
iota," the ninth, and smallest, letter of the greek alphabet", noun 
irascible," easily provoked to anger, very irritable", adjective 
irate," extremely angry, wrathful, enraged", adjective 
ire," to anger, to fret, to irritate", verb 
iridescent," producing a display of lustrous, rainbow-like colors", adjective 
irk," to irritate, annoy, bother", verb 
irksome," disagreeable or troublesome, bothersome, annoying", adjective 
irony, use of words to convey meaning opposite the literal meaning, noun 
irradiance, incident flux of radiant energy per unit area, noun 
irradiate," to throw rays of light upon, to illuminate, to brighten", verb 
irrational," not rational, unfounded or nonsensical", adjective 
irreducible, not able to be reduced or lessened, adjective 
irrefragable," which cannot be refuted, indisputable, clearly right", adjective 
irrefragable, not able to be refuted or disproved, adjective 
irrefrangible," not to broken or transgressed, inviolable", adjective 
irrefutable," undeniable, unable to be disproved or refuted", adjective 
irrelevant," not related, not applicable, unimportant, not connected", adjective 
irreligious, contrary to religious beliefs and practices, adjective 
irreparable," incapable of being repaired, amended, cured or rectified", adjective 
irrepressible, not containable or controllable, adjective 
irreproachable," free from blame, not open to reproach or criticism", adjective 
irresistible, not able to be resisted, adjective 
irresolute, undecided or unsure how to act, adjective 
irresponsible, lacking a sense of responsibility, adjective 
irreverent," lacking proper respect or seriousness, sarcastic", adjective 
irreversible, incapable of being reversed or turned about or back, adjective 
irrevocable," unable to be retracted or reversed, final", adjective 
irrhetorical, not rhetorical, adjective 
irrigate, to supply farmland with water, verb 
irritable, capable of being irritated, adjective 
irritancy, the quality of being irritant or irritating, noun 
irritate," to provoke impatience, anger, or displeasure", verb 
irruption," the action of irrupting or breaking into, a violent entry", noun 
isle, an island, noun 
islet, a small island, noun 
isobar, atoms having equal weight but different atomis numbers, noun 
isochronous, happening at regular intervals, adjective 
isolate, to set apart or cut off from others, verb 
isothermal, of a process that takes place at constant temperature, adjective 
itinerary, a route or proposed route of a journey, noun 
itinerate, to travel from place to place, verb 
jaded, dulled or satiated by overindulgence, verb 
jargon, a technical terminology unique to a particular subject, noun 
jaundice," to color by prejudice or envy, to prejudice", verb 
jaunt," to ramble here and there, to stroll, to make an excursion", verb 
jeer, to utter sarcastic or mocking comments, verb 
jejune," without interest or significance, dull", adjective 
jeopardy," danger of loss, harm, or failure", noun 
jeremiad, a prolonged lamentation or mournful complaint, noun 
jettison, to cast (goods) overboard in order to lighten a vessel, verb 
jingo, one who supports policy favouring war, noun 
jingoist," the policy or practice of jingoes, bellicose chauvinism", adjective 
jocose," given to or characterized by joking, jesting, humorous", adjective 
jocular," characterized by, or intended for joking or jesting", adjective 
jocund," cheerful, merry, gay, blithe, glad", adjective 
joggle," to shake slightly, to jostle, to jog", verb 
jollity," the state of being jolly, cheerfulness", noun 
journalize, to record in a journal, verb 
joust, to engage in mock combat on horseback, verb 
jovial, endowed with or characterized by a hearty or joyous humor, adjective 
jubilant," showing great joy, satisfaction, or triumph, rejoicing", adjective 
judgment, the act of judging, noun 
judicature, the administration of justice by judges and courts, noun 
judicial, of or relating to a court of law, adjective 
judicious," having, or characterized by, good judgment or sound thinking", adjective 
juggernaut," any large, overpowering, destructive force or object", noun 
juggle," to manipulate objects, such as balls, clubs, etc artfully", verb 
jugglery, the art of a juggler (i e trickery or deception), noun 
jugular," relating to, or located near, the neck or throat", adjective 
junction," the act of joining, or the state of being joined", noun 
juncture," a place where things join, a junction", noun 
juridical," pertaining to the law or rule of law, legal, judicial", adjective 
jurisdiction," the power, right, or authority to interpret and apply law", noun 
jurisprudence, the science or philosophy of law, noun 
juror, a member of a jury, noun 
justification, reason or excuse which gives acceptable support for behavior, noun 
jut, to stick out, verb 
juvenile," young, not fully developed", adjective 
juxtapose," to place close together or side by side, esp. for comparison", verb 
juxtaposition, to place in juxtaposition, verb 
keen," to sharpen, to make cold", verb 
keepsake, something kept for sentimental or nostalgic reasons, noun 
kerchief, a piece of cloth used to cover the head, noun 
kernel, the body of a seed inside the husk, noun 
killjoy," a person who is anti-fun, or prevents others from having fun", noun 
kiln," a furnace or oven for burning, baking, or drying something", noun 
kindle, to start (a fire) or light (a torch), verb 
kindred, of the same nature, adjective 
kinetic, pertaining to motion, adjective 
kinfolk, relatives or kindred, noun 
kingling," a kinglet, a petty king or ruler", noun 
kismet," fate, destiny", noun 
kleptomaniac, one who steals compulsively, noun 
knave," a tricky, deceitful fellow, a dishonest person, a rogue", noun 
knavery," the (mis)behaviour of a knave, boyish mischief", noun 
knead, to work into a mass by repeated pressure with the knuckles, verb 
knell," sound made by a bell rung slowly, especially for funerals", noun 
knickknack," an ornamental trinket or gimcrack, a bit of bric-a-brac", noun 
knoll," a small, rounded hill or eminence, hillock", noun 
knotty, full of knots, adjective 
kudos," praise, accolades", noun 
laborious," requiring much physical effort, toilsome", adjective 
labyrinth," to enclose in a labyrinth, or as though in a labyrinth", verb 
labyrinthine," physically resembling a labyrinth, maze-like", adjective 
lacerate," to tear, rip or wound", verb 
laceration, an irregular open wound caused by a blunt impact, noun 
lachrymose," suggestive of or tending to cause tears, mournful", adjective 
lackadaisical, showing no interest or enthusiasm, adjective 
lackey," to attend, wait upon, serve obsequiously", verb 
